id,cs,derivation,text
99,14,metonymy,Он спокойным голосом сообщил: есть первые боевые потери
106,15,metonymy, Он любил рассказывать веселые анекдоты за ужином.
114,17,literal, Вчера на рынке продавали живых раков.
120,18,metaphor,Нужно как-то сдвинуть этот вопрос с мертвой точки.
128,19,metaphor,― Не морочьте мне голову! ― последовал холодный ответ.
138,21,metaphor,В каналах Венеции отражалось свинцовое небо.
143,22,metonymy,Молочная аллергия встречается у 3% маленьких детей.
148,23,metaphor,"Тогда я был молод, мечтал о многом и стремился к солнечному будущему."
155,24,metonymy_proximal   ,"Он услышал ее смех ― глупый, счастливый, беззаботный смех девочки"
164,25,metonymy_proximal,"Я не мог больше слушать его пьяных криков, встал и ушел."
171,26,metonymy_distal,"Это опасная нервная работа, которую обычно выполняют не все."
179,27,metonymy_proximal,"“Чего желал — он всего добился...”, — закончил он с грустным вздохом."
187,28,literal,"Наш водитель совсем молодой, задорный паренек."
194,29,metonymy_distal,Сейчас в Москве дворы ― унылое зрелище.
203,30,metonymy_distal,В газете «London Daily News» опубликована любопытная статья.
209,31,literal,Как-то пару раз беспокойная мамаша поймала меня за руку на улице.
217,32,metonymy_proximal,Вокруг нас вились босоногие дети с голодными глазами.
223,33,metonymy_proximal,"Он бойким, веселым шагом пошел по тропинке."
232,34,proximal_proximal_metonymy_2,"Слышались возгласы, добродушные шутки, радостный смех."
239,35,proximal_proximal_metonymy_2,"Было столько лживых слухов, что даже реальным фактам никто уже не верил."
247,36,proximal_proximal_metonymy_2,Не верь его наглой клевете!
254,37,literal,Внимательные ученики сразу же нашли ошибку в задании.
262,38,literal,Как бы не прослыть наивным дурачком...
270,39,proximal_metonymy_1,"Записи, сделанные в журнале ленивой рукой протоколиста, говорят о многом."
278,40,literal,"Нестор просто обманул ее, причем легко, как глупую малолетку!"
285,41,proximal_proximal_metonymy_2,Откуда берутся такие уверенные суждения об одаренности детей?
292,42,proximal_metonymy_1,"Иван краснел, бросая робкие взгляды на пассажирку."
298,43,literal,Он был живой и смелый мальчик с богатой фантазией.
304,44,homonym2,На складе лежали строевые бревна всех размеров
311,45,homonym2,На вешалке висело серебристое газовое платье.
316,46,homonym2,При оплодотворении в половом размножении гаметы сливаются в одну клетку.
324,47,monosemy,Она вынула из картонки шляпу с широкими лентами
329,48,monosemy,В огромном пустом небе висела круглая луна.
335,49,monosemy,Он сидел в углу больничного коридора на длинной скамейке.
347,52,monosemy,"Наша кошка темноты, громких звуков и теней."
352,53,monosemy,"В чемодане хранятся иголки, наперстки и клубок серой шерсти."
6,1,literal,Он был очень злым человеком.
14,2,homonym2,Строительная компания приобрела новый карьерный экскаватор.
23,3,metaphor,В газете напечатана статья под крикливым заголовком.
30,4,homonym2,"Федя сидел за кормовым веслом, как и подобало капитану."
37,5,metaphor,"Эта книга мне нравится, в ней много трезвых рассуждений"
44,6,metonymy,На строгий вопрос матери “Где деньги?” он не ответил.
50,7,literal,"Ведь вы же умный человек, вы же должны понимать…"
58,8,literal,Ненавижу этих бездушных чиновников!
64,9,metonymy,Агрессивное поведение часто является результатом беспокойства. 
71,10,metaphor,Сегодня в городе ожидается сумасшедшее количество туристов.
78,11,literal,Он оказался чутким и деликатным человеком.
85,12,literal,"Мы вошли в лифт, он захлопнул железную дверь и нажал кнопку."
93,13,metonymy,Как-то раз я наглотался сонных таблеток.
100,14,metonymy,Он поднял штанину и показал следы боевых ран.
107,15,metaphor,"Поблескивая на солнце водяными бликами, журчали веселые ручейки."
115,17,metaphor,Oн обладает  живым умом и богатой эрудицией
121,18,literal,"Береговая линия загрязнена на 40 км, поэтому тут много мертвых рыб."
129,19,literal,Я лежу на холодном полу в центре комнаты.
149,23,literal,В августе этого года должно быть солнечное затмение.
156,24,metonymy_distal   ,Так что теперь можно лишь вспомнить о тех беззаботных временах.
165,25,metonymy_distal,Как же я ненавижу все эти пьяные откровения!
172,26,literal,Анорексия и плохой сон у нервных детей -  нередкие явления.
180,27,metonymy_distal,"Не буду описывать, как попал сюда, это довольно-таки грустная история."
188,28,metonymy_proximal,"Она была краснощекая, с серыми задорными глазами и рыжими волосами."
195,29,metonymy_distal,Яркие пятна оживляют унылый городской пейзаж.
204,30,literal,Это издание в первую очередь адресовано любопытным школьникам.
210,31,metonymy_distal,"Для меня настало тревожное, беспокойное время."
218,32,literal,Оборванные и голодные дети клянчили у прохожих мелочь.
224,33,metonymy_proximal,"В окошке появилась веселая рожица Миши, который махал нам рукой."
233,34,proximal_metonymy_1,"Он заговорил совершенно другим, простым и добродушным тоном."
240,35,literal,Терпеть не могу лживых мальчишек.
248,36,proximal_proximal_metonymy_2,Следователь задавал ему очень наглые вопросы.
255,37,proximal_proximal_metonymy_2,Некоторые формулировки при внимательном анализе оказываются неполными.
263,38,proximal_proximal_metonymy_2,Он с наивным удивлением поднял брови.
271,39,literal,Это задание вызовет интерес даже у самого ленивого ученика.
279,40,proximal_proximal_metonymy_2,Отвечать на глупые вопросы было некогда.
286,41,proximal_metonymy_1,Он шагнул навстречу и уверенным жестом протянул руку в приветствии.
293,42,proximal_proximal_metonymy_2,Через некоторое время раздался робкий стук в дверь.
299,43,proximal_proximal_metonymy_2,Громов все же сделал несколько смелых заявлений.
305,44,homonym2,Вокруг росли корабельные строевые сосны.
317,46,homonym2,СПИД при половом контакте передается с вероятностью 25 процентов.
330,48,monosemy,"Астроном Вебер сообщил, что нашел на Солнце круглое пятно."
7,1,metonymy,Его злое лицо вдруг покраснело.
15,2,homonym2,Этот «Додж-Рэм» тащит на буксире карьерный самосвал.
24,3,literal,Крикливая торговка на базаре предлагала купить яблоки и зелень.
31,4,homonym2,"В кормовой части лязгнуло, по кораблю прошла мелкая дрожь."
38,5,metaphor,"В первую очередь, нужно дать трезвую оценку этой ситуации."
51,7,metonymy,"Пес сел и, подняв вверх умную морду, тоскливо завыл."
65,9,metaphor, Он надел короткое пальто агрессивного ярко-зеленого цвета
72,10,metaphor,В сумасшедшем ритме нашей жизни всякое случается. 
79,11,literal,"Она была очень деликатна, старалась никого не обременять собой"
86,12,literal,Капли дождя стучали по железной крыше.
94,13,literal,Но все же я встал и перенес сонную дочь с дивана к себе в постель.
101,14,literal,Мы прекратили работу через две недели после начала боевых операций.
108,15,metaphor,Солнышко веселыми лучами освещало дорогу.
122,18,metaphor,Концы веревки были завязаны мертвым узлом - никак не развязать.
150,23,literal,Этот аккумулятор работает на солнечной энергии
157,24,metonymy_distal,Эти четыре солнечных беззаботных дня я отчетливо помню до сих пор.
166,25,literal, В ДТП со смертельным исходом часто виноваты пьяные водители.
173,26,metonymy_proximal,Нервные пальцы молодого человека быстро перелистывали журнал.
181,27,metonymy_proximal,Старик обернулся и с грустной улыбкой помахал им рукой.
189,28,metonymy_distal,Послышался смех Ларочки и задорные восклицания.
196,29,metonymy_proximal, Он бренчал на балалайке и выводил унылым басом «Очи черные».
211,31,metonymy_proximal,По ночам через стену слышу беспокойный шепот.
225,33,literal,Веселые музыканты заиграли польку.
234,34,literal,"Председатель был толстый и добродушный дядька, эстонец."
241,35,literal,Необходимо избавляться от ненужных связей и лживых друзей.
249,36,proximal_proximal_metonymy_2,Я был возмущен его наглым поступком.
256,37,proximal_proximal_metonymy_2,Эта статья требует внимательного чтения и долгого размышления.
264,38,proximal_metonymy_1, Она слушала меня с наивной улыбкой и кивала головой.
272,39,proximal_proximal_metonymy_2,С ленивым зевком он выронил из рук печатный листок.
280,40,proximal_proximal_metonymy_2,Что за глупая идея! ― вскричал Иван Ильич
287,41,proximal_metonymy_1,Она  вышла на сцену уверенным шагом и поклонилась.
306,44,homonym2,"Это самое близкое к морю место, где произрастает строевой кедр."
318,46,homonym2,"В собранном мною анамнезе я отметил, что пациент начал половую жизнь поздно."
8,1,metaphor,"В Арктике всегда дуют очень сильные ветры, метут злые вьюги и метели."
16,2,homonym2,Наша компания является лидером в производстве карьерного транспорта.
52,7,metonymy,"Сейчас, сейчас, надену очки и сделаю умное лицо."
87,12,metaphor,В армии царила железная дисциплина
123,18,metonymy,"Мертвая бледность, остановка пульса и окоченевшие конечности - первые признаки смерти. "
158,24,literal,"Он уснул на траве, как беззаботный ребенок на руках няньки"
174,26,metonymy_distal,"Бомбы падали, и нервная атмосфера в подвале быстро накалялась."
182,27,metonymy_distal,Пианист играл очень грустную мелодию.
197,29,metonymy_distal,"Вот оно, когда-то легендарное Батищево. Сейчас здесь унылая картина."
212,31,metonymy_distal,Мою голову все чаще посещают беспокойные мысли.
226,33,metonymy_distal,Для Гули это была одна из самых веселых поездок.
242,35,proximal_metonymy_1,Я взглянул на ее лживое лицо и ужаснулся.
257,37,proximal_proximal_metonymy_2,Благодарим за внимательное отношение к нашей работе.
265,38,proximal_proximal_metonymy_2, Как далеки были эти наивные мечты от страшной действительности!
273,39,proximal_proximal_metonymy_2,Ленивым движением он вытащил из кармана пачку сигарет.
319,46,homonym2,Они посчитали это дискриминацией по половому признаку и подали жалобу.
17,2,homonym2,Современные карьерные машины оснащаются специальными системами.
159,24,metonymy_proximal,Он с беззаботным видом ходил по комнате из угла в угол.
198,29,metonymy_proximal,"Особенно тягостно действовал на нервы протяжный, унылый вой собак."
227,33,metonymy_distal,Режиссер А. Стефанович поставит веселый фильм для детей.
